### ISSUE TITLE
Magma reports no enodeb connected - cell is active

### ISSUE THREAD

**Issue by bmurithi** [magma/magma#380]
Magma Version: 0.3.72-1559068613-fb90001f

```
$ enodebd_cli.py get_all_status
No status information to report.
Either there are no connected eNodeB devices, or no TR-069 messages have been received yet.
$ sudo tcpdump -i enp2s0.103
tcpdump: verbose output suppressed, use -v or -vv for full protocol decode
listening on enp2s0.103, link-type EN10MB (Ethernet), capture size 262144 bytes
16:50:20.373708 IP 192.168.150.100.36412 > 192.168.150.244.36412: sctp (1) [HB REQ] 
16:50:20.375778 IP 192.168.150.244.36412 > 192.168.150.100.36412: sctp (1) [HB ACK] 
16:50:23.355812 IP 192.168.150.244.36412 > 192.168.150.100.36412: sctp (1) [HB REQ] 
16:50:23.355907 IP 192.168.150.100.36412 > 192.168.150.244.36412: sctp (1) [HB ACK] 
16:50:24.306353 IP 192.168.150.244.42458 > 192.168.150.100.tproxy: Flags [S], seq 3257783156, win 14600, options [mss 1460,nop,nop,sackOK,nop,wscale 9], length 0
16:50:24.306487 IP 192.168.150.100.tproxy > 192.168.150.244.42458: Flags [S.], seq 130657479, ack 3257783157, win 29200, options [mss 1460,nop,nop,sackOK,nop,wscale 7], length 0
16:50:24.307724 IP 192.168.150.244.42458 > 192.168.150.100.tproxy: Flags [.], ack 1, win 29, length 0
16:50:24.307832 IP 192.168.150.244.42458 > 192.168.150.100.tproxy: Flags [P.], seq 1:82, ack 1, win 29, length 81
16:50:24.307875 IP 192.168.150.100.tproxy > 192.168.150.244.42458: Flags [.], ack 82, win 229, length 0
16:50:24.307979 IP 192.168.150.244.42458 > 192.168.150.100.tproxy: Flags [.], seq 82:1542, ack 1, win 29, length 1460
16:50:24.308010 IP 192.168.150.100.tproxy > 192.168.150.244.42458: Flags [.], ack 1542, win 251, length 0
16:50:24.308147 IP 192.168.150.244.42458 > 192.168.150.100.tproxy: Flags [.], seq 1542:7382, ack 1, win 29, length 5840
16:50:24.308188 IP 192.168.150.100.tproxy > 192.168.150.244.42458: Flags [.], ack 7382, win 343, length 0
16:50:24.308341 IP 192.168.150.244.42458 > 192.168.150.100.tproxy: Flags [.], seq 7382:11762, ack 1, win 29, length 4380
16:50:24.308380 IP 192.168.150.100.tproxy > 192.168.150.244.42458: Flags [.], ack 11762, win 411, length 0
16:50:24.309398 IP 192.168.150.244.42458 > 192.168.150.100.tproxy: Flags [P.], seq 11762:12479, ack 1, win 29, length 717
16:50:24.309468 IP 192.168.150.100.tproxy > 192.168.150.244.42458: Flags [.], ack 12479, win 434, length 0
16:50:24.309505 IP 192.168.150.244.42458 > 192.168.150.100.tproxy: Flags [.], seq 12479:28539, ack 1, win 29, length 16060
16:50:24.309540 IP 192.168.150.100.tproxy > 192.168.150.244.42458: Flags [.], ack 28539, win 685, length 0
16:50:24.310882 IP 192.168.150.244.42458 > 192.168.150.100.tproxy: Flags [P.], seq 28539:34324, ack 1, win 29, length 5785
16:50:24.310969 IP 192.168.150.100.tproxy > 192.168.150.244.42458: Flags [.], ack 34324, win 775, length 0
16:50:24.323556 IP 192.168.150.100.tproxy > 192.168.150.244.42458: Flags [P.], seq 1:150, ack 34324, win 775, length 149
16:50:24.324629 IP 192.168.150.244.42458 > 192.168.150.100.tproxy: Flags [.], ack 150, win 31, length 0
16:50:24.326129 IP 192.168.150.244.42458 > 192.168.150.100.tproxy: Flags [F.], seq 34324, ack 150, win 31, length 0
16:50:24.327560 IP 192.168.150.100.tproxy > 192.168.150.244.42458: Flags [F.], seq 150, ack 34325, win 775, length 0
16:50:24.328794 IP 192.168.150.244.42458 > 192.168.150.100.tproxy: Flags [.], ack 151, win 31, length 0
^C
26 packets captured
26 packets received by filter
0 packets dropped by kernel
$ 
```

```
Jun 25 16:50:24 lte enodebd[561]: INFO:aiohttp.access:192.168.150.244 - - [25/Jun/2019:13:50:24 +0000] "POST /A20190625.1345%2B0000-1350%2B0000_48BF74.120200004917CNJ0041.xml HTTP/1.1" 200 0 "-" "-"

```

![Selection_121](https://user-images.githubusercontent.com/6918709/60104328-eb817180-9769-11e9-8579-c27e9958a02c.png)

**Comment by bmurithi** [comment]
Same issue observed on a different enodeb.

![screencap_20190627_008](https://user-images.githubusercontent.com/6918709/60288775-9a19e380-991d-11e9-95df-c13ef8640df0.png)

![screencap_20190627_009](https://user-images.githubusercontent.com/6918709/60288783-9d14d400-991d-11e9-8007-5aa2dc888842.png)

**Comment by bmurithi** [comment]
Possibly a state management issue.

Appears to be related to the gateway rebooting while the eNodeB remains on.

**Cell Uptime**

![screencap_20190628_006](https://user-images.githubusercontent.com/6918709/60341601-b4080480-99b7-11e9-8642-394a5c1e81c4.png)

**Gateway uptime**

![screencap_20190628_007](https://user-images.githubusercontent.com/6918709/60341614-c2eeb700-99b7-11e9-971d-e7c9ed82a361.png)

**Comment by xjtian** [comment]
I'll have @andreilee try to repro on our end. Anecdotally this is something we have seen before and pushed a fix for but this one could be a different RC.

Just a thought - if the gateway has only been up for 11 minutes, there's a possibility that it hasn't gotten an inform from the enodeb yet. We'll dig into this here

**Comment by bmurithi** [comment]
Could be too early. I'll share additional samples of gateway uptime(s) where this manifests.

**Comment by bmurithi** [comment]
This one did recover.

> UPTIME: `19:07:45 up 1 day,  6:47,  1 user,  load average: 0.14, 0.20, 0.18`

Went from this:

```
eNodeB connected.....................1
eNodeB Configured....................0
Opstate Enabled......................1
RF TX on.............................1
GPS Connected........................0
PTP Connected........................0
MME Connected........................0
FSM State...............Waiting for empty message from eNodeB
```

to this:

```
eNodeB connected.....................1
eNodeB Configured....................1
Opstate Enabled......................1
RF TX on.............................1
GPS Connected........................1
PTP Connected........................0
MME Connected........................1
FSM State...............Completed provisioning eNB. Awaiting new Inform.
```

At which point the reported status was accurate.

**Comment by bmurithi** [comment]
Here's another - with the cell active.

```
$ uptime
 19:13:02 up 2 days,  8:01,  1 user,  load average: 0.15, 0.13, 0.11
$ enodebd_cli.py get_all_status
eNodeB connected.....................1
eNodeB Configured....................0
Opstate Enabled......................0
RF TX on.............................0
GPS Connected........................0
PTP Connected........................0
MME Connected........................0
FSM State...............Error state - awaiting manual reboot
```

![screencap_20190702_002](https://user-images.githubusercontent.com/6918709/60528814-fd30bf00-9cfd-11e9-8c17-1776fbccd340.png)

**Comment by bmurithi** [comment]
Observed this again on one site - the cell was active.
Rebooted the eNodeB from its management interface - cell activated shortly after.
Magma still reports no enodeb connected.
Then, I rebooted all magma services - no enodeb reported as active.

```
~$ enodebd_cli.py get_all_status
No status information to report.
Either there are no connected eNodeB devices, or no TR-069 messages have been received yet.

~$ uptime
 13:17:20 up 40 min,  2 users,  load average: 0.53, 0.64, 0.44

# a while later

:~$ uptime
 13:40:29 up  1:03,  2 users,  load average: 0.23, 0.19, 0.19

:~$ enodebd_cli.py get_all_status
No status information to report.
Either there are no connected eNodeB devices, or no TR-069 messages have been received yet.
```


![image](https://user-images.githubusercontent.com/6918709/61945432-9b840d80-afa8-11e9-9320-686c933af13d.png)

**Comment by andreilee** [comment]
Looks to be the same as this issue here: https://github.com/facebookincubator/magma/issues/480

Closing as duplicate issue.
