### ISSUE TITLE
[aws debug] srsRAN UE attach test fails on docker based Access Gateway(ARM)

### ISSUE THREAD

**Issue by ShubhamTatvamasi** [magma/magma#11941]
Action items for @ShubhamTatvamasi:

1. Deploy docker AGW on AWS x86 instance and run srsRAN UE attach test.
2. If test passed. Test same on ARM AGW.

Action items for @m-govind:

1. Share steps to deploy docker based AGW on AWS graviton2 instance.

**Comment by ShubhamTatvamasi** [comment]
So I used the following steps to deploy docker based AGW on x86 machine.
https://github.com/ShubhamTatvamasi/magma-agw-docker-setup

after that checkin was successful: 
```
ubuntu@ip-172-31-19-234:~$ docker exec magmad checkin_cli.py
1. -- Testing TCP connection to controller.magmaindia.org:443 --
2. -- Testing Certificate --
3. -- Testing SSL --
4. -- Creating direct cloud checkin --
5. -- Creating proxy cloud checkin --

Success!
```

But getting attach error using srsRAN:
```
ubuntu@ip-172-31-29-180:~/srsRAN-demo$ docker-compose up
[+] Running 2/0
 ⠿ Container srsenb  Created                                                                                                        0.0s
 ⠿ Container srsue   Created                                                                                                        0.0s
Attaching to srsenb, srsue
srsenb  | ---  Software Radio Systems LTE eNodeB  ---
srsenb  |
srsenb  | Couldn't open , trying /root/.config/srsran/enb.conf
srsenb  | Couldn't open /root/.config/srsran/enb.conf either, trying /etc/srsran/enb.conf
srsenb  | Reading configuration file /etc/srsran/enb.conf...
srsenb  | Failed to `mlockall`: {}
srsenb  | Built in Release mode using 21.10.0.
srsenb  |
srsenb  | Opening 1 channels in RF device=zmq with args=fail_on_disconnect=true,tx_port=tcp://*:2000,rx_port=tcp://localhost:2001,id=enb,base_srate=23.04e6
srsenb  | Available RF device list: zmq
srsenb  | CHx base_srate=23.04e6
srsenb  | CHx id=enb
srsenb  | Current sample rate is 1.92 MHz with a base rate of 23.04 MHz (x12 decimation)
srsenb  | CH0 rx_port=tcp://localhost:2001
srsenb  | CH0 tx_port=tcp://*:2000
srsenb  | CH0 fail_on_disconnect=true
srsenb  | S1 Setup Failure. Cause: misc - unknown-PLMN
srsue   | Couldn't open , trying /root/.config/srsran/ue.conf
srsue   | Couldn't open /root/.config/srsran/ue.conf either, trying /etc/srsran/ue.conf
srsue   | Reading configuration file /etc/srsran/ue.conf...
srsue   |
srsue   | Built in Release mode using 21.10.0.
srsue   |
srsue   | Failed to `mlockall`: 12Opening 1 channels in RF device=zmq with args=tx_port=tcp://*:2001,rx_port=tcp://localhost:2000,id=ue,base_srate=23.04e6
srsue   | Available RF device list: zmq
srsue   | CHx base_srate=23.04e6
srsue   | CHx id=ue
srsue   | Current sample rate is 1.92 MHz with a base rate of 23.04 MHz (x12 decimation)
srsue   | CH0 rx_port=tcp://localhost:2000
srsue   | CH0 tx_port=tcp://*:2001
srsenb  |
srsenb  | ==== eNodeB started ===
srsenb  | Type <t> to view trace
srsenb  | Current sample rate is 11.52 MHz with a base rate of 23.04 MHz (x2 decimation)
srsenb  | Current sample rate is 11.52 MHz with a base rate of 23.04 MHz (x2 decimation)
srsenb  | Setting frequency: DL=2680.0 Mhz, UL=2560.0 MHz for cc_idx=0 nof_prb=50
srsenb  | Closing stdin thread.
srsue   | Waiting PHY to initialize ... done!
srsue   | Attaching UE...
srsue   | Closing stdin thread.
srsue   | Current sample rate is 1.92 MHz with a base rate of 23.04 MHz (x12 decimation)
srsue   | Current sample rate is 1.92 MHz with a base rate of 23.04 MHz (x12 decimation)
srsue   | .
srsue   | Found Cell:  Mode=FDD, PCI=1, PRB=50, Ports=1, CP=Normal, CFO=-0.2 KHz
srsue   | Current sample rate is 11.52 MHz with a base rate of 23.04 MHz (x2 decimation)
srsue   | Current sample rate is 11.52 MHz with a base rate of 23.04 MHz (x2 decimation)
srsue   | Found PLMN:  Id=00101, TAC=7
srsue   | Random Access Transmission: seq=32, tti=2101, ra-rnti=0x2
srsenb  | RACH:  tti=2101, cc=0, preamble=32, offset=0, temp_crnti=0x46
srsue   | Received ConnectionReject. Wait time: 10
srsue   | Random Access Complete.     c-rnti=0x46, ta=0
srsenb  | Disconnecting rnti=0x46.
srsenb  | S1setup failed
srsenb  | Failed to initiate S1 connection. Attempting reconnection in 10 seconds
srsenb  | S1 Setup Failure. Cause: misc - unknown-PLMN
srsue   | Attach failed (attempt 1/5)
srsenb  | S1setup failed
srsenb  | Failed to initiate S1 connection. Attempting reconnection in 10 seconds
srsue   | Current sample rate is 1.92 MHz with a base rate of 23.04 MHz (x12 decimation)
srsue   | Current sample rate is 1.92 MHz with a base rate of 23.04 MHz (x12 decimation)
srsue   | .
srsue   | Found Cell:  Mode=FDD, PCI=1, PRB=50, Ports=1, CP=Normal, CFO=-0.2 KHz
srsue   | Current sample rate is 11.52 MHz with a base rate of 23.04 MHz (x2 decimation)
srsue   | Current sample rate is 11.52 MHz with a base rate of 23.04 MHz (x2 decimation)
srsue   | Found PLMN:  Id=00101, TAC=7
srsue   | Random Access Transmission: seq=45, tti=6741, ra-rnti=0x2
srsenb  | RACH:  tti=6741, cc=0, preamble=45, offset=0, temp_crnti=0x47
srsue   | Received ConnectionReject. Wait time: 10
srsue   | Random Access Complete.     c-rnti=0x47, ta=0
srsenb  | Disconnecting rnti=0x47.
srsenb  | S1 Setup Failure. Cause: misc - unknown-PLMN
srsenb  | S1setup failed
srsenb  | Failed to initiate S1 connection. Attempting reconnection in 10 seconds
```

Here is the tcpdump from AGW eth1:
```
ubuntu@ip-172-31-19-234:~$ sudo tcpdump -i eth1
tcpdump: verbose output suppressed, use -v or -vv for full protocol decode
listening on eth1, link-type EN10MB (Ethernet), capture size 262144 bytes
15:16:50.169295 IP 172.31.29.180.47134 > 172.31.22.210.36412: sctp (1) [INIT] [init tag: 2398981478] [rwnd: 106496] [OS: 10] [MIS: 65535] [init TSN: 609034481]
15:16:50.169392 IP 172.31.22.210.36412 > 172.31.29.180.47134: sctp (1) [INIT ACK] [init tag: 3890248488] [rwnd: 106496] [OS: 16] [MIS: 10] [init TSN: 2377491201]
15:16:50.169589 IP 172.31.29.180.47134 > 172.31.22.210.36412: sctp (1) [COOKIE ECHO]
15:16:50.169773 IP 172.31.22.210.36412 > 172.31.29.180.47134: sctp (1) [COOKIE ACK]
15:16:50.170144 IP 172.31.29.180.47134 > 172.31.22.210.36412: sctp (1) [DATA] (B)(E) [TSN: 609034481] [SID: 0] [SSEQ 0] [PPID S1AP]
15:16:50.170189 IP 172.31.22.210.36412 > 172.31.29.180.47134: sctp (1) [SACK] [cum ack 609034481] [a_rwnd 106447] [#gap acks 0] [#dup tsns 0]
15:16:50.172092 IP 172.31.22.210.36412 > 172.31.29.180.47134: sctp (1) [DATA] (B)(E) [TSN: 2377491201] [SID: 0] [SSEQ 0] [PPID S1AP]
15:16:50.172298 IP 172.31.29.180.47134 > 172.31.22.210.36412: sctp (1) [SACK] [cum ack 2377491201] [a_rwnd 106479] [#gap acks 0] [#dup tsns 0]
15:17:07.116046 ARP, Request who-has 172.31.22.210 tell 172.31.16.1, length 28
15:17:07.116074 ARP, Reply 172.31.22.210 is-at 02:3f:e4:da:7b:93 (oui Unknown), length 28
15:17:22.599019 IP 172.31.29.180.47134 > 172.31.22.210.36412: sctp (1) [HB REQ]
15:17:22.599077 IP 172.31.22.210.36412 > 172.31.29.180.47134: sctp (1) [HB ACK]
15:17:23.266448 IP 172.31.22.210.36412 > 172.31.29.180.47134: sctp (1) [HB REQ]
15:17:23.266700 IP 172.31.29.180.47134 > 172.31.22.210.36412: sctp (1) [HB ACK]
15:17:25.628099 IP 172.31.29.180.47134 > 172.31.22.210.36412: sctp (1) [SHUTDOWN]
15:17:25.628165 IP 172.31.22.210.36412 > 172.31.29.180.47134: sctp (1) [SHUTDOWN ACK]
15:17:25.629049 IP 172.31.29.180.47134 > 172.31.22.210.36412: sctp (1) [SHUTDOWN COMPLETE]
15:17:37.475604 IP 172.31.29.180.53947 > 172.31.22.210.36412: sctp (1) [INIT] [init tag: 1755399128] [rwnd: 106496] [OS: 10] [MIS: 65535] [init TSN: 1456450227]
15:17:37.475743 IP 172.31.22.210.36412 > 172.31.29.180.53947: sctp (1) [INIT ACK] [init tag: 4196538653] [rwnd: 106496] [OS: 16] [MIS: 10] [init TSN: 1845810895]
15:17:37.475972 IP 172.31.29.180.53947 > 172.31.22.210.36412: sctp (1) [COOKIE ECHO]
15:17:37.476015 IP 172.31.22.210.36412 > 172.31.29.180.53947: sctp (1) [COOKIE ACK]
15:17:37.476212 IP 172.31.29.180.53947 > 172.31.22.210.36412: sctp (1) [DATA] (B)(E) [TSN: 1456450227] [SID: 0] [SSEQ 0] [PPID S1AP]
15:17:37.476234 IP 172.31.22.210.36412 > 172.31.29.180.53947: sctp (1) [SACK] [cum ack 1456450227] [a_rwnd 106447] [#gap acks 0] [#dup tsns 0]
15:17:37.478943 IP 172.31.22.210.36412 > 172.31.29.180.53947: sctp (1) [DATA] (B)(E) [TSN: 1845810895] [SID: 0] [SSEQ 0] [PPID S1AP]
15:17:37.479063 IP 172.31.29.180.53947 > 172.31.22.210.36412: sctp (1) [SACK] [cum ack 1845810895] [a_rwnd 106479] [#gap acks 0] [#dup tsns 0]
15:17:43.395564 IP 172.31.29.180.53947 > 172.31.22.210.36412: sctp (1) [SHUTDOWN]
15:17:43.395619 IP 172.31.22.210.36412 > 172.31.29.180.53947: sctp (1) [SHUTDOWN ACK]
15:17:43.395763 IP 172.31.29.180.53947 > 172.31.22.210.36412: sctp (1) [SHUTDOWN COMPLETE]
15:17:55.221098 IP 172.31.29.180.50691 > 172.31.22.210.36412: sctp (1) [INIT] [init tag: 607633962] [rwnd: 106496] [OS: 10] [MIS: 65535] [init TSN: 3960283480]
15:17:55.221192 IP 172.31.22.210.36412 > 172.31.29.180.50691: sctp (1) [INIT ACK] [init tag: 338000790] [rwnd: 106496] [OS: 16] [MIS: 10] [init TSN: 1342334816]
15:17:55.221335 IP 172.31.29.180.50691 > 172.31.22.210.36412: sctp (1) [COOKIE ECHO]
15:17:55.221384 IP 172.31.22.210.36412 > 172.31.29.180.50691: sctp (1) [COOKIE ACK]
15:17:55.221572 IP 172.31.29.180.50691 > 172.31.22.210.36412: sctp (1) [DATA] (B)(E) [TSN: 3960283480] [SID: 0] [SSEQ 0] [PPID S1AP]
15:17:55.221593 IP 172.31.22.210.36412 > 172.31.29.180.50691: sctp (1) [SACK] [cum ack 3960283480] [a_rwnd 106447] [#gap acks 0] [#dup tsns 0]
15:17:55.223625 IP 172.31.22.210.36412 > 172.31.29.180.50691: sctp (1) [DATA] (B)(E) [TSN: 1342334816] [SID: 0] [SSEQ 0] [PPID S1AP]
15:17:55.223768 IP 172.31.29.180.50691 > 172.31.22.210.36412: sctp (1) [SACK] [cum ack 1342334816] [a_rwnd 106479] [#gap acks 0] [#dup tsns 0]
15:18:01.119610 IP 172.31.29.180.50691 > 172.31.22.210.36412: sctp (1) [SHUTDOWN]
15:18:01.119663 IP 172.31.22.210.36412 > 172.31.29.180.50691: sctp (1) [SHUTDOWN ACK]
15:18:01.119774 IP 172.31.29.180.50691 > 172.31.22.210.36412: sctp (1) [SHUTDOWN COMPLETE]
15:18:03.435816 ARP, Request who-has 172.31.22.210 tell 172.31.16.1, length 28
15:18:03.435843 ARP, Reply 172.31.22.210 is-at 02:3f:e4:da:7b:93 (oui Unknown), length 28
^C
41 packets captured
41 packets received by filter
0 packets dropped by kernel
```

**Comment by ShubhamTatvamasi** [comment]
Getting the following errors from:
```bash
docker logs magmad
```
```
ERROR:root:GetServiceInfo Error for pipelined! [StatusCode.UNAVAILABLE] failed to connect to all addresses
ERROR:root:GetServiceInfo Error for envoy_controller! [StatusCode.UNAVAILABLE] failed to connect to all addresses
```

**Comment by ShubhamTatvamasi** [comment]
Hi @arunuke, can you please take a look at our x86_64 based AGW docker deployment? 
I have added your ssh keys from https://github.com/arunuke.keys on the server for you to verify the setup.
```bash
ssh ubuntu@54.193.175.73
```
