### ISSUE TITLE
empty envelope InformResponse from enodebd (TR-069 message handling)

### ISSUE THREAD

**Issue by katojunya** [magma/magma#618]
# Summary

It seems that enodebd does not send TR-069 InformResponse message correctly.
No envelope message is observed

```
Internet Protocol Version 4, Src: 192.88.99.142, Dst: 192.168.60.252
Transmission Control Protocol, Src Port: 48080, Dst Port: 34090, Seq: 18, Ack: 5604, Len: 135
Hypertext Transfer Protocol
    HTTP/1.1 200 OK\r\n
        Response Version: HTTP/1.1
        Status Code: 200
        Response Phrase: OK
    Date: Thu, 05 Sep 2019 16:36:46 GMT\r\n
    Server: WSGIServer/0.2 CPython/3.5.3\r\n
    Content-Length: 0\r\n
    Content-Type: text/xml; charset=utf-8\r\n
    \r\n
    **** NO ENVELOPE ****
```

# Environment

- Cell: BaiCells pBS1109 (one of variants of Intel base TDD-LTE station)
- Software Version: BaiBS_RTL_1.4.3

# Procedures
1. restart enodebd by 'make restart'
1. Power Cell on and make cell send Inform message to enodebd. enodebd seems to be able to recoginze Informed paramters and enodebd_cli.py CLI can show IP address and device serial. But FSM does not move to WaitEmptyMessage state.
1. enodebd send empty envelope HTTP/200 OK as response message to cell.
1. Cell keeps retrying to send Inform message.

# Syslog (level DEBUG)

Sep  5 17:00:14 magma-dev enodebd[16940]: DEBUG:root:Handling TR069 message: <cl
ass 'magma.enodebd.tr069.models.Inform'>
Sep  5 17:00:14 magma-dev enodebd[16940]: DEBUG:root:(Inform msg) Received param
eter: Device.DeviceInfo.HardwareVersion = VER.C
Sep  5 17:00:14 magma-dev enodebd[16940]: DEBUG:root:(Inform msg) Received param
eter: Device.DeviceInfo.ManufacturerOUI = 48BF74
Sep  5 17:00:14 magma-dev enodebd[16940]: DEBUG:root:(Inform msg) Received param
eter: Device.DeviceInfo.SerialNumber = XXXXXXXXXXXXXXP0062
Sep  5 17:00:14 magma-dev enodebd[16940]: DEBUG:root:(Inform msg) Received param
eter: Device.DeviceInfo.SoftwareVersion = BaiBS_RTL_1.4.3_SVN8461
Sep  5 17:00:14 magma-dev enodebd[16940]: DEBUG:root:(Inform msg) Received param
eter: Device.DeviceInfo.X_BAICELLS_COM_CloudKey = None
Sep  5 17:00:14 magma-dev enodebd[16940]: DEBUG:root:(Inform msg) Received param
eter: Device.DeviceInfo.X_BAICELLS_COM_STATION_RUN_Time = 0d 0h 5m 59s
Sep  5 17:00:14 magma-dev enodebd[16940]: DEBUG:root:(Inform msg) Received param
eter: Device.ManagementServer.ConnectionRequestURL = http://192.168.60.252:7547/
f993e7f28f9bccae831978b98cc54add
Sep  5 17:00:14 magma-dev enodebd[16940]: DEBUG:root:(Inform msg) Received param
eter: Device.ManagementServer.ParameterKey = None
Sep  5 17:00:14 magma-dev enodebd[16940]: DEBUG:root:(Inform msg) Received param
eter: Device.Services.FAPService.1.AccessMgmt.LTE.HNBName = None
Sep  5 17:00:14 magma-dev enodebd[16940]: DEBUG:root:(Inform msg) Received param
eter: Device.Services.FAPService.1.FAPControl.LTE.OpState = false
Sep  5 17:00:14 magma-dev enodebd[16940]: DEBUG:root:(Inform msg) Received param
eter: Device.Services.FAPService.1.FAPControl.LTE.RFTxStatus = false
Sep  5 17:00:14 magma-dev enodebd[16940]: DEBUG:root:(Inform msg) Received param
eter: Device.Services.FAPService.1.FAPControl.OpState = false
Sep  5 17:00:14 magma-dev enodebd[16940]: DEBUG:root:(Inform msg) Received param
eter: Device.Services.FAPService.1.FAPControl.X_BAICELLS_COM_AlarmStatus = Minor
Sep  5 17:00:14 magma-dev enodebd[16940]: DEBUG:root:(Inform msg) Received parameter: Device.Services.FAPService.1.FAPControl.X_NSN_COM_AlarmStatus = Minor
Sep  5 17:00:14 magma-dev enodebd[16940]: DEBUG:root:(Inform msg) Received parameter: Device.Services.FAPService.1.REM.LTE.CellNumberOfEntries = 64
Sep  5 17:00:14 magma-dev enodebd[16940]: DEBUG:root:(Inform msg) Received parameter: Device.Services.FAPService.1.REM.LTE.LastScanTime = 2037-12-30T11:12:49
Sep  5 17:00:14 magma-dev enodebd[16940]: DEBUG:root:(Inform msg) Received parameter: Device.Services.FAPService.1.REM.LTE.ScanStatus = 3
Sep  5 17:00:14 magma-dev enodebd[16940]: DEBUG:root:(Inform msg) Received parameter: Device.Services.FAPService.1.REM.UMTS.WCDMA.CellNumberOfEntries = 64
Sep  5 17:00:14 magma-dev enodebd[16940]: DEBUG:root:(Inform msg) Received parameter: Device.Services.FAPService.1.REM.UMTS.WCDMA.LastScanTime = 2012-05-31T19:58:10
Sep  5 17:00:14 magma-dev enodebd[16940]: DEBUG:root:(Inform msg) Received parameter: Device.Services.FAPService.1.REM.UMTS.WCDMA.ScanStatus = Indeterminate
Sep  5 17:00:14 magma-dev enodebd[16940]: DEBUG:root:(Inform msg) Received parameter: Device.Services.FAPService.1.REM.X_BAICELLS_COM_REM_Status = 1

vvvvvvvvvvvvvvvvvvvvvvvvvvvvvvvvvvvvvvvvvvvvvvvvvvvvvvvvvvvvvvvvvvvvvvvvvvvvvvv
Sep  5 17:00:14 magma-dev enodebd[16940]: DEBUG:root:Sending TR069 message: {}
^^^^^^^^^^^^^^^^^^^^^^^^^^^^^^^^^^^^^^^^^^^^^^^^^^^^^^^^^^^^^^^^^^^^^^^^^^^^^^^
'{}' should be InformResponse?

Sep  5 17:00:14 magma-dev enodebd[16940]: DEBUG:spyne:gc.collect() took around 20ms.
Sep  5 17:00:14 magma-dev enodebd[16940]: DEBUG:root:192.168.60.252 - "POST /smallcell/AcsService HTTP/1.1" 200 0

# CLI outputs

```
(python) vagrant@magma-dev:~/magma/lte/gateway$ enodebd_cli.py get_all_status
--- eNodeB Serial: XXXXXXXXXXXXXXP0062 ---
IP Address..............192.168.60.252
eNodeB connected.....................1
eNodeB Configured....................0
Opstate Enabled......................0
RF TX on.............................0
RF TX desired........................0
GPS Connected........................0
PTP Connected........................0
MME Connected........................0
GPS Longitude...............113.902086
GPS Latitude.................22.931965
FSM State...............Waiting for eNB REM to run
```

**Comment by ekowtaylor** [comment]
Stale
